id,name,duration,lat,lng,description
1,Golden Gate Walk,45,37.8199,-122.4783,Walk across the bridge
2,Pier 39 Visit,30,37.8087,-122.4098,See sea lions and shops
3,Japanese Tea Garden,60,37.7700,-122.4708,Relax in nature
4,Twin Peaks Hike,90,37.7544,-122.4477,Panoramic city view
5,City Lights Bookstore,20,37.7975,-122.4064,Independent bookstore stop
6,Central Park Walk,75,40.7829,-73.9654,Stroll through Manhattan's green oasis
7,Statue of Liberty Tour,120,40.6892,-74.0445,Visit the iconic symbol of freedom
8,Brooklyn Bridge Walk,45,40.7061,-73.9969,Walk across the historic suspension bridge
